{
  "schema_version": 2,
  "id": "panyan-fund",
  "name": "磐岩基金",
  "aliases": [
    "上海磐岩私募基金管理有限公司"
  ],
  "group": "emerging",
  "coverage": {
    "role": "watchlist",
    "reason": "已核旧平台履历与管理人登记，但新机构独立募资、具名投资及业绩证据仍有限。"
  },
  "founded": {
    "year": 2026,
    "basis": "投中嘉川／36氪与创业邦独立报道均指向2026年2月成立，2026年8月完成管理人登记。登记与基金募集、投资、业绩分别看待。"
  },
  "team": [
    {
      "name": "韩锐",
      "role": "创始人、总经理兼投资负责人",
      "previous_firms": [
        "高榕资本",
        "中国投资有限责任公司"
      ],
      "background": "原高榕合伙人，早年在中投公司私募股权投资部负责TMT直接投资；新机构实控人。"
    },
    {
      "name": "袁烽",
      "role": "合伙人",
      "previous_firms": [
        "高榕资本",
        "中芯国际",
        "中国科学院微电子研究所"
      ],
      "background": "原高榕主管先进制造及半导体投资，具有芯片产业与工程师经历。"
    }
  ],
  "focus": null,
  "stage": null,
  "representative_cases": [
    {
      "company": "巨子生物",
      "attribution": "prior_firm",
      "investor_or_team": "韩锐／原高榕资本时期",
      "outcome": "媒体表述为参与或主导过的原平台项目之一；未逐项核定主导程度，不将其视作磐岩投资、退出或收益。",
      "evidence_source_ids": [
        "s01"
      ]
    },
    {
      "company": "泰凌微",
      "attribution": "prior_firm",
      "investor_or_team": "袁烽／原高榕资本时期",
      "outcome": "媒体列为其在原平台主导的项目；未取得新机构投资或已实现回报证据。",
      "evidence_source_ids": [
        "s01"
      ]
    }
  ],
  "recent_activity": "2026年8月完成私募股权／创业投资管理人登记；截至查阅日未找到足够可靠的独立募资完成或新机构具名投资公告。",
  "why_follow": "观察名单。两位来自高榕的成熟投资人具备消费互联网与半导体履历，符合老VC团队独立创业路径；新机构正式策略、募资与独立业绩待确认。",
  "difference": "新管理人团队横跨消费互联网及半导体；这仅描述成员既有能力，不能自动等同于新基金已官宣投资范围。",
  "contacts": {
    "website": null,
    "careers_url": null,
    "recruitment_email": null,
    "other_email": null,
    "other_email_purpose": null
  },
  "notes": "本条为观察名单，不把备案、过往履历或媒体对首期基金的一般评论写成新基金已证明业绩。；新机构focus与stage保留null，等待正式策略材料。；两篇盘点对韩锐过往具名项目列示不同；保留来源清楚的有限样本，不将所有高榕项目都归给他。；未找到独立官网及招聘渠道。",
  "sources": [
    {
      "id": "s01",
      "title": "35家新GP备案：谁还在进入一级市场？｜投中嘉川／36氪",
      "url": "https://www.36kr.com/p/4017039299448968",
      "supports": "成立与登记月份；韩锐袁烽背景；原平台投资经历",
      "published_date": "2026-10-08",
      "checked_at": "2026-10-30"
    },
    {
      "id": "s02",
      "title": "8月新登记10家私募基金管理人，通过率显著提高｜创业邦睿兽分析",
      "url": "https://www.cyzone.cn/article/845798.html",
      "supports": "2026年2月成立与8月登记；新机构独立股权关系；韩锐前高榕合伙人",
      "published_date": "2026-09-08",
      "checked_at": "2026-10-30"
    },
    {
      "id": "s03",
      "title": "韩锐｜投资界历史人物页",
      "url": "https://vc.pedaily.cn/people/14867.html",
      "supports": "高榕及中投公司既往任职背景；人物页未必更新至独立后的新身份",
      "published_date": null,
      "checked_at": "2026-10-30"
    }
  ],
  "checked_at": "2026-10-30",
  "organization_type": "investment_firm",
  "targeting": {
    "kind": "editorial_assessment",
    "player_group": "new_entrant",
    "wave": "watchlist",
    "rationale": "高榕投资人独立设立与管理人登记有来源，正式AI策略、募集和独立投资仍有缺口，暂列观察候选。",
    "source_ids": [
      "s01",
      "s02",
      "s03"
    ],
    "labelled_at": "2026-10-31"
  },
  "channels": []
}
