{
  "schema_version": 2,
  "id": "mpci",
  "name": "经纬创投（MPCi）",
  "aliases": [
    "MPC Investments",
    "Matrix Partners China",
    "经纬中国"
  ],
  "group": "established",
  "coverage": {
    "role": "main",
    "reason": "团队或机构背景、具名案例和近期活动有公开出处，列入主要研究样本；不表示基金收益已核实。"
  },
  "founded": {
    "year": 2008,
    "basis": "官网机构介绍；2024年英文品牌调整并非新成立机构。"
  },
  "team": [
    {
      "name": "张颖",
      "role": "创始合伙人",
      "previous_firms": [
        "中经合集团",
        "荷兰银行创投业务部"
      ],
      "background": "投资界人物页披露此前任中经合中国区首席代表及荷兰银行高级投资经理。"
    }
  ],
  "focus": "软件与科技、先进制造、消费等；持续关注机器人。",
  "stage": "早期、初创及成长；官网强调尽早接触创业者，争取成为首家机构投资人并后续追加。",
  "representative_cases": [
    {
      "company": "理想汽车",
      "attribution": "current_firm",
      "investor_or_team": "经纬创投",
      "outcome": "投资界张颖人物页列为典型投资；上市案例，不据此计算基金回报。",
      "evidence_source_ids": [
        "s04"
      ]
    },
    {
      "company": "小鹏汽车",
      "attribution": "current_firm",
      "investor_or_team": "经纬创投",
      "outcome": "公开机构介绍与人物页均列为案例。",
      "evidence_source_ids": [
        "s04",
        "s03"
      ]
    },
    {
      "company": "破壳机器人（PokeBot）",
      "attribution": "current_firm",
      "investor_or_team": "经纬创投",
      "outcome": "顺为官方2026年8月回顾披露，经纬与顺为联合领投其Pre-A轮。",
      "evidence_source_ids": [
        "s05"
      ]
    }
  ],
  "recent_activity": "顺为官方2026年8月回顾披露，经纬与顺为联合领投破壳机器人Pre-A轮；该信息为共同投资方一手披露。",
  "why_follow": "编辑分析：有新能源车与制造类项目的长期积累，同时仍在早期机器人项目出手。",
  "difference": "编辑分析：相比纯种子基金，经纬强调首轮机构角色、后续融资与运营支持，也能在成长阶段追加；需区分这种平台能力与单个投资人的专长。",
  "contacts": {
    "website": "https://www.mpc.vc/",
    "careers_url": null,
    "recruitment_email": null,
    "other_email": "info@mpc.vc",
    "other_email_purpose": "一般联系；未标为招聘邮箱"
  },
  "notes": "保留Matrix Partners China作为历史别名，不把英文更名当作新VC；2026年融资活动已补为官方单篇公告。",
  "sources": [
    {
      "id": "s01",
      "title": "关于经纬",
      "url": "https://www.mpc.vc/about",
      "supports": "2008年成立、领域与阶段",
      "published_date": null,
      "checked_at": "2026-10-30"
    },
    {
      "id": "s02",
      "title": "经纬与创业者",
      "url": "https://www.mpc.vc/about/relationship",
      "supports": "首家机构投资人、早期接触和后续投资打法",
      "published_date": null,
      "checked_at": "2026-10-30"
    },
    {
      "id": "s03",
      "title": "经纬新英文品牌MPCi报道",
      "url": "https://finance.sina.com.cn/stock/focus/2025-01-10/doc-ineentrt5462279.shtml",
      "supports": "2024年品牌变更及机构历史",
      "published_date": "2025-01-10",
      "checked_at": "2026-10-30"
    },
    {
      "id": "s04",
      "title": "张颖 — 2025投资界TOP100投资人",
      "url": "https://www.pedaily.cn/2025investor/4551.shtml",
      "supports": "创始人职衔、前机构及理想/小鹏案例",
      "published_date": null,
      "checked_at": "2026-10-30"
    },
    {
      "id": "s05",
      "title": "顺为8月回顾",
      "url": "https://shunwei.com/news/2804",
      "supports": "官方2026年8月回顾：破壳机器人Pre-A由顺为与经纬联合领投；顺为于2026年4月投其天使轮，宇树于2021年A轮领投及B轮追加",
      "published_date": "2026-09-03",
      "checked_at": "2026-10-30"
    },
    {
      "id": "s06",
      "title": "联系我们",
      "url": "https://www.mpc.vc/contact-us",
      "supports": "一般联系邮箱",
      "published_date": null,
      "checked_at": "2026-10-30"
    }
  ],
  "checked_at": "2026-10-30",
  "organization_type": "investment_firm",
  "targeting": {
    "kind": "editorial_assessment",
    "player_group": "incumbent",
    "wave": "later",
    "rationale": "现有材料为已持续运作的成熟投资平台；保留资料，后续按已有玩家中的AI团队研究，本轮不新增搜集。",
    "source_ids": [
      "s01",
      "s02"
    ],
    "labelled_at": "2026-10-31"
  },
  "channels": []
}
